[
  {
    "id": "FUL-146",
    "slug": "fulfillment-delay",
    "seoTitle": "Fulfillment Delay and Reschedule Journey Example",
    "seoDescription": "How a late fulfillment is held as its own state, with the original commitment still intact behind it, then routed to continue, reschedule or escalate.",
    "titleCharacterCount": 48,
    "descriptionCharacterCount": 150,
    "primaryIntent": "customer journey examples",
    "secondaryIntent": "fulfillment delay journey",
    "canonicalPath": "/lab/journeys/fulfillment-delay",
    "index": true,
    "follow": true,
    "sitemap": true,
    "sourceBasis": [
      "name",
      "purpose",
      "trigger",
      "entityScope",
      "primaryStructure"
    ],
    "needsSeoReview": false,
    "reviewReason": null
  },
  {
    "id": "FUL-147",
    "slug": "dispatch-and-delivery-tracking",
    "seoTitle": "Dispatch and Delivery Tracking Lifecycle Journey",
    "seoDescription": "A flow that hands execution to whoever performs the delivery while the obligation stays open and ours, tracking it to delivered, failed or unknown.",
    "titleCharacterCount": 48,
    "descriptionCharacterCount": 147,
    "primaryIntent": "marketing automation journeys",
    "secondaryIntent": "delivery tracking journey",
    "canonicalPath": "/lab/journeys/dispatch-and-delivery-tracking",
    "index": true,
    "follow": true,
    "sitemap": true,
    "sourceBasis": [
      "name",
      "purpose",
      "trigger",
      "entityScope",
      "behaviors"
    ],
    "needsSeoReview": false,
    "reviewReason": null
  },
  {
    "id": "FUL-148",
    "slug": "delivery-attempt-failure",
    "seoTitle": "Failed Delivery Attempt Recovery Journey Example",
    "seoDescription": "Recovering a failed delivery according to why it failed, inside a bounded number of attempts. Review the retry, correction, alternate and return paths.",
    "titleCharacterCount": 48,
    "descriptionCharacterCount": 151,
    "primaryIntent": "customer journey examples",
    "secondaryIntent": "failed delivery recovery journey",
    "canonicalPath": "/lab/journeys/delivery-attempt-failure",
    "index": true,
    "follow": true,
    "sitemap": true,
    "sourceBasis": [
      "name",
      "purpose",
      "trigger",
      "entityScope",
      "behaviors"
    ],
    "needsSeoReview": false,
    "reviewReason": null
  },
  {
    "id": "FUL-149",
    "slug": "delivery-acceptance-finalization",
    "seoTitle": "Delivery Acceptance and Finalization Journey Map",
    "seoDescription": "Arriving and being agreed to have arrived correctly are different facts here. Follow the confirmation, the issue window and the route to finalization.",
    "titleCharacterCount": 48,
    "descriptionCharacterCount": 150,
    "primaryIntent": "customer lifecycle examples",
    "secondaryIntent": "delivery acceptance journey",
    "canonicalPath": "/lab/journeys/delivery-acceptance-finalization",
    "index": true,
    "follow": true,
    "sitemap": true,
    "sourceBasis": [
      "name",
      "purpose",
      "trigger",
      "entityScope",
      "primaryStructure"
    ],
    "needsSeoReview": false,
    "reviewReason": null
  },
  {
    "id": "FUL-150",
    "slug": "fulfillment-cancellation",
    "seoTitle": "Fulfillment Cancellation Customer Journey Example",
    "seoDescription": "Stopping what remains of an obligation while keeping everything that already happened. See how completed, in-progress and unstarted work are separated.",
    "titleCharacterCount": 49,
    "descriptionCharacterCount": 151,
    "primaryIntent": "customer lifecycle examples",
    "secondaryIntent": "order cancellation journey",
    "canonicalPath": "/lab/journeys/fulfillment-cancellation",
    "index": true,
    "follow": true,
    "sitemap": true,
    "sourceBasis": [
      "name",
      "purpose",
      "trigger",
      "entityScope"
    ],
    "needsSeoReview": false,
    "reviewReason": null
  },
  {
    "id": "IDN-81",
    "slug": "identity-claim-verification",
    "seoTitle": "Identity Claim Verification Journey Example",
    "seoDescription": "How confidence is established in one specific identity claim and bound to the evidence behind it, ending in verified, rejected or more evidence needed.",
    "titleCharacterCount": 43,
    "descriptionCharacterCount": 151,
    "primaryIntent": "customer journey examples",
    "secondaryIntent": "identity verification journey",
    "canonicalPath": "/lab/journeys/identity-claim-verification",
    "index": true,
    "follow": true,
    "sitemap": true,
    "sourceBasis": [
      "name",
      "purpose",
      "trigger",
      "entityScope",
      "behaviors"
    ],
    "needsSeoReview": false,
    "reviewReason": null
  },
  {
    "id": "IDN-82",
    "slug": "verification-dependency",
    "seoTitle": "Verification Dependency and Process Unblock Journey",
    "seoDescription": "A verification requirement held as its own state, blocking only the process that needs it and releasing that process only once everything is rechecked.",
    "titleCharacterCount": 51,
    "descriptionCharacterCount": 151,
    "primaryIntent": "marketing automation journeys",
    "secondaryIntent": "blocked verification journey",
    "canonicalPath": "/lab/journeys/verification-dependency",
    "index": true,
    "follow": true,
    "sitemap": true,
    "sourceBasis": [
      "name",
      "purpose",
      "trigger",
      "entityScope",
      "primaryStructure"
    ],
    "needsSeoReview": false,
    "reviewReason": null
  },
  {
    "id": "IDN-83",
    "slug": "document-validation",
    "seoTitle": "Document Submission and Validation Journey Map",
    "seoDescription": "Uploading a document and satisfying a requirement stay separate facts. Follow validation to accept, reject or replace, bound to the requirement assessed.",
    "titleCharacterCount": 46,
    "descriptionCharacterCount": 153,
    "primaryIntent": "customer journey examples",
    "secondaryIntent": "document verification journey",
    "canonicalPath": "/lab/journeys/document-validation",
    "index": true,
    "follow": true,
    "sitemap": true,
    "sourceBasis": [
      "name",
      "purpose",
      "trigger",
      "entityScope"
    ],
    "needsSeoReview": false,
    "reviewReason": null
  },
  {
    "id": "IDN-84",
    "slug": "verification-failure-routing",
    "seoTitle": "Verification Failure Routing Customer Journey Map",
    "seoDescription": "Routing a failed verification by the reason it failed, and keeping internal errors out of the customer record. Retry, remediate, review or exit branches.",
    "titleCharacterCount": 49,
    "descriptionCharacterCount": 153,
    "primaryIntent": "marketing automation journeys",
    "secondaryIntent": "verification failure journey",
    "canonicalPath": "/lab/journeys/verification-failure-routing",
    "index": true,
    "follow": true,
    "sitemap": true,
    "sourceBasis": [
      "name",
      "purpose",
      "trigger",
      "entityScope",
      "behaviors"
    ],
    "needsSeoReview": false,
    "reviewReason": null
  },
  {
    "id": "IDN-85",
    "slug": "authentication-challenge",
    "seoTitle": "Authentication Challenge Customer Journey Example",
    "seoDescription": "Establishing that whoever is present controls the required identity, at the assurance the context demands. See the authenticate, step up and deny exits.",
    "titleCharacterCount": 49,
    "descriptionCharacterCount": 152,
    "primaryIntent": "customer journey examples",
    "secondaryIntent": "authentication journey",
    "canonicalPath": "/lab/journeys/authentication-challenge",
    "index": true,
    "follow": true,
    "sitemap": true,
    "sourceBasis": [
      "name",
      "purpose",
      "trigger",
      "entityScope",
      "behaviors"
    ],
    "needsSeoReview": false,
    "reviewReason": null
  },
  {
    "id": "IDN-86",
    "slug": "step-up-authentication",
    "seoTitle": "Step-Up Authentication Journey Map for Sensitive Actions",
    "seoDescription": "Raising identity assurance before a sensitive action runs, then confirming the action is still authorised. Follow the resume and deny branches in full.",
    "titleCharacterCount": 56,
    "descriptionCharacterCount": 151,
    "primaryIntent": "customer lifecycle examples",
    "secondaryIntent": "step-up authentication journey",
    "canonicalPath": "/lab/journeys/step-up-authentication",
    "index": true,
    "follow": true,
    "sitemap": true,
    "sourceBasis": [
      "name",
      "purpose",
      "trigger",
      "entityScope",
      "behaviors"
    ],
    "needsSeoReview": true,
    "reviewReason": "Subject overlaps materially with IDN-85 (authentication challenge); both cover authenticating an actor with a step-up or deny outcome and may compete on the same query."
  },
  {
    "id": "IDN-87",
    "slug": "authentication-failure-pattern",
    "seoTitle": "Authentication Failure Pattern and Recovery Journey",
    "seoDescription": "Telling an ordinary forgotten password apart from an account under attack, without turning the first into the second. Security check, recover or restrict.",
    "titleCharacterCount": 51,
    "descriptionCharacterCount": 154,
    "primaryIntent": "lifecycle marketing journeys",
    "secondaryIntent": "login failure journey",
    "canonicalPath": "/lab/journeys/authentication-failure-pattern",
    "index": true,
    "follow": true,
    "sitemap": true,
    "sourceBasis": [
      "name",
      "purpose",
      "trigger",
      "entityScope"
    ],
    "needsSeoReview": false,
    "reviewReason": null
  },
  {
    "id": "IDN-88",
    "slug": "account-recovery",
    "seoTitle": "Account Recovery and Access Restoration Journey Map",
    "seoDescription": "A way back into an account someone can no longer authenticate to, built so the recovery route is never weaker than the access it replaces. Prove control.",
    "titleCharacterCount": 51,
    "descriptionCharacterCount": 153,
    "primaryIntent": "customer journey examples",